URL,Title,Description,Category,Image URL,ACTIVE,Captured
https://www.synozur.com/post/claude-comes-inside-the-microsoft-365-boundary,Claude Comes Inside the Microsoft 365 Boundary,"Anthropic’s Claude AI is now an official Microsoft data processor, enabling secure integration within the Microsoft 365 trust boundary. Business users gain access to Claude’s advanced reasoning and coding capabilities directly in Word, Excel, Teams, and more—without new contracts or compliance hurdles.",Blog Posts,"https://static.wixstatic.com/media/b805ce_b27009136574436f884e939e282b3286~mv2.jpg/v1/fill/w_1000,h_667,al_c,q_85,usm_0.66_1.00_0.01/b805ce_b27009136574436f884e939e282b3286~mv2.jpg",TRUE,2026-03-21
https://www.synozur.com/post/content-without-compromise-inside-the-m-files-microsoft-alliance,Content without Compromise - Inside the M-Files & Microsoft Alliance,"In this Polaris episode, Synozur’s CTO Chris McNulty, along with Ryan Barry of M-Files and Ian Story of Microsoft, explores how a first-of-its-kind partnership between M-Files and Microsoft is revolutionizing content management – uniting AI-powered intelligent document workflows with the Microsoft 365 platform to eliminate content silos and unlock new value from enterprise data.",Blog Posts,"https://static.wixstatic.com/media/b805ce_6c20258d8f094ab898004ce24868dc6a~mv2.jpg/v1/fill/w_1000,h_563,al_c,q_85,usm_0.66_1.00_0.01/b805ce_6c20258d8f094ab898004ce24868dc6a~mv2.jpg",TRUE,2026-03-21
https://www.synozur.com/post/copilot-culture-the-cloud-2025-at-synozur,Polaris - 2025 In Review,"Four Synozur leaders - Michelle Boyd, Michelle Caldwell, Joshua Christensen & Shari Oswald – joing Chris McNulty on a special holiday edition of Polaris to reflect on 2025's seismic shifts in AI, the gap between technology and organizational maturity, and why 2026 will separate those who merely adopted tools from those who fundamentally transformed how work gets done.",Blog Posts,"https://static.wixstatic.com/media/b805ce_fca6d956096a49d3a2642a761ba34b4b~mv2.jpg/v1/fill/w_1000,h_563,al_c,q_85,usm_0.66_1.00_0.01/b805ce_fca6d956096a49d3a2642a761ba34b4b~mv2.jpg",TRUE,2026-03-21
https://www.synozur.com/post/gpt-5-2-arrives-in-m365-copilot,GPT-5.2 Arrives in M365 Copilot,GPT 5.2 has areived - and it’s available in M365 Copilot,Blog Posts,"https://static.wixstatic.com/media/b805ce_7120b02e213240f596cabf8e845d38c5~mv2.png/v1/fill/w_1000,h_667,al_c,q_90,usm_0.66_1.00_0.01/b805ce_7120b02e213240f596cabf8e845d38c5~mv2.png",TRUE,2026-03-21
https://www.synozur.com/post/humanity-as-a-strategy-leadership-lessons-from-ed-deangelis,Humanity as a Strategy: Leadership Lessons from Ed DeAngelis,"Ed DeAngelis, CEO of EDA Contractors and Titan 100 honoree, shares how he transformed a roofing company into an industry leader by embracing servant leadership and making ""humanity as a strategy"" the foundation of his business.",Blog Posts,"https://static.wixstatic.com/media/b805ce_f9e616a33dfb40dfb5bbdcd73a582ce9~mv2.jpg/v1/fill/w_1000,h_563,al_c,q_85,usm_0.66_1.00_0.01/b805ce_f9e616a33dfb40dfb5bbdcd73a582ce9~mv2.jpg",TRUE,2026-03-21
https://www.synozur.com/post/ignite-2025-sharepoint-steps-up-as-copilots-knowledge-platform,Ignite 2025: SharePoint Steps Up as Copilot's Knowledge Platform,All the SharePoint AI news from Microsoft Ignite 2025 - from using SharePoint metadata and the SharePoint Admin agent.,Blog Posts,"https://static.wixstatic.com/media/b805ce_b2373c0a5ac94723a11d5f155bc89ede~mv2.jpeg/v1/fill/w_1000,h_667,al_c,q_85,usm_0.66_1.00_0.01/b805ce_b2373c0a5ac94723a11d5f155bc89ede~mv2.jpeg",TRUE,2026-03-21
https://www.synozur.com/post/ignite-day-one-work-iq-agent-365-and-the-next-wave-of-copilot,"Ignite Day One: Work IQ, Agent 365, and the Next Wave of Copilot","Today’s announcements at Microsoft Ignite push Copilot from “smart assistant” to an operating layer for how work actually gets done. Microsoft introduced Work IQ, Agent 365, dedicated Office app agents, new Outlook voice and scheduling, expanded Copilot voice, Sora 2 for enterprise video, and an autonomous Sales Development Agent—with a pragmatic model and content strategy to match. Here’s what matters, why it’s different, and how to act this quarter.",Blog Posts,"https://static.wixstatic.com/media/b805ce_8d2d9a5b69574f5daf0091e11e1b20a8~mv2.jpeg/v1/fill/w_1000,h_667,al_c,q_85,usm_0.66_1.00_0.01/b805ce_8d2d9a5b69574f5daf0091e11e1b20a8~mv2.jpeg",TRUE,2026-03-21
https://www.synozur.com/post/microsoft-purview-s-adaptive-dlp-brings-scalable-control-to-copilot,Microsoft Purview's Adaptive DLP Brings Scalable Control to Copilot,"Microsoft’s new Purview Data Loss Prevention (DLP) adaptive scopes for SharePoint have quietly introduced a pivotal capability for enterprise AI governance.This update – currently in preview (generally available by March 2026) – enables organizations to dynamically and automatically control which SharePoint content Microsoft 365 Copilot can access, based on policy-driven rules rather than static manual lists. It’s a significant shift that empowers business and IT leaders to govern AI at scale, f",Blog Posts,"https://static.wixstatic.com/media/b805ce_231ea81983db46b7a440d0bc83b1bb96~mv2.png/v1/fill/w_1000,h_667,al_c,q_90,usm_0.66_1.00_0.01/b805ce_231ea81983db46b7a440d0bc83b1bb96~mv2.png",TRUE,2026-03-21
https://www.synozur.com/post/not-too-big-not-too-small-techcon-is-just-right,"Not Too Big, Not Too Small - TechCon is Just Right","In our latest Polaris episode, we explore how mid-sized tech conferences (like TechCon 365 Seattle – coming up June 27) are closing the AI skills gap and sparking community engagement – with guest David Wilhelm sharing insights on training, diversity, and the unique power of in-person connection.",Blog Posts,"https://static.wixstatic.com/media/b805ce_3c8bc48e7a0443a0b40ec5c9abd6d522~mv2.jpg/v1/fill/w_1000,h_563,al_c,q_85,usm_0.66_1.00_0.01/b805ce_3c8bc48e7a0443a0b40ec5c9abd6d522~mv2.jpg",TRUE,2026-03-21
https://www.synozur.com/post/polaris-podcast-fractional-cxos-get-our-undivided-attention,Polaris Podcast: Fractional CxOs Get Our Undivided Attention,"Our latest episode of our Polaris podcast, “Fractional CxOs Get Our Undivided Attention"" dives into the evolving role of fractional leaders.",Blog Posts,"https://static.wixstatic.com/media/b805ce_f8380800e4974a1295c2a2e2feed1f91~mv2.png/v1/fill/w_1000,h_563,al_c,q_90,usm_0.66_1.00_0.01/b805ce_f8380800e4974a1295c2a2e2feed1f91~mv2.png",TRUE,2026-03-21
https://www.synozur.com/post/polaris-strategy-unplugged-with-dr-john-hillen,Polaris: Strategy Unplugged with Dr. John Hillen,"On the latest Polaris episode, unlock the true essence of business strategy with Dr. John Hillen as we delve into the intricacies of strategy, its misconceptions, and how to nurture it as a fundamental strength of your leadership team.",Blog Posts,"https://static.wixstatic.com/media/b805ce_3664d913e23f4e87856fffedcbbc7079~mv2.jpg/v1/fill/w_1000,h_563,al_c,q_85,usm_0.66_1.00_0.01/b805ce_3664d913e23f4e87856fffedcbbc7079~mv2.jpg",TRUE,2026-03-21
https://www.synozur.com/post/polaris-walk-the-project-runway-with-michelle-boyd,Polaris: Walk the Project Runway with Michelle Boyd,"In this episode of Polaris, Chris McNulty and Michelle Boyd discuss the importance of delivery excellence in project management.",Blog Posts,"https://static.wixstatic.com/media/b805ce_d3021ab0f7404f22a1cc27a03a82d4c0~mv2.jpg/v1/fill/w_1000,h_563,al_c,q_85,usm_0.66_1.00_0.01/b805ce_d3021ab0f7404f22a1cc27a03a82d4c0~mv2.jpg",TRUE,2026-03-21
https://www.synozur.com/post/sharepoint-s-next-25-years,SharePoint's Next 25 Years,"On this episode of Polaris, Synozur CTO Chris McNulty welcomes Adam Harmetz, Corporate Vice President for SharePoint at Microsoft, to discuss how SharePoint’s 25-year journey has turned it into a knowledge engine for AI, why empowered metadata is key to modern intranets and how generative AI models like ChatGPT, Sora and Nano Banana signal what’s ahead for enterprise content.",Blog Posts,"https://static.wixstatic.com/media/b805ce_54e790758cfc4fe0adf30bd5134e9ea5~mv2.jpg/v1/fill/w_1000,h_563,al_c,q_85,usm_0.66_1.00_0.01/b805ce_54e790758cfc4fe0adf30bd5134e9ea5~mv2.jpg",TRUE,2026-03-21
https://www.synozur.com/post/summer-of-copilot-endless-summer,Summer of Copilot - Endless Summer,"In our “Summer of Copilot – Endless Summer” finale, we recap how Microsoft’s AI assistant has reshaped work in 2025 and what’s next. From ubiquitous presence in Office apps to specialized agents like Researcher and Analyst, Copilot became a true digital colleague. We highlight major use cases (creative content, sales proposals, knowledge support) delivering real ROI, and how Synozur guides businesses in adopting Copilot responsibly. Plus, a look at Copilot’s place in the broader AI ecosystem",Blog Posts,"https://static.wixstatic.com/media/b805ce_484614fbe030417cabc2d2d4f8328702~mv2.jpeg/v1/fill/w_1000,h_667,al_c,q_85,usm_0.66_1.00_0.01/b805ce_484614fbe030417cabc2d2d4f8328702~mv2.jpeg",TRUE,2026-03-21
https://www.synozur.com/post/tarmacs-tariffs-and-transformation,"Tarmacs, Tariffs, and Transformation","A practical conversation with Synozur’s transformation leader Rob Asen on why transformation offices succeed where traditional PMOs stall, how AI changes leadership reach, and the five lenses that put strategy into motion: vision, leadership, impact, capacity, and measurement.",Blog Posts,"https://static.wixstatic.com/media/b805ce_86142b133bb14b86b1a71b47f58cd15b~mv2.jpg/v1/fill/w_1000,h_563,al_c,q_85,usm_0.66_1.00_0.01/b805ce_86142b133bb14b86b1a71b47f58cd15b~mv2.jpg",TRUE,2026-03-21
https://www.synozur.com/post/the-king-of-data-migration-magic-with-jordan-uytterhagen,The King of Data Migration Magic with Jordan (Uytterhagen),Free your data from legacy systems and learn how to prepare for an AI‑driven future in this Polaris episode featuring Cadence Solutions CEO Jordan Utytterhagen.,Blog Posts,"https://static.wixstatic.com/media/b805ce_69e1742e21ca4513b66f3961b43c3130~mv2.jpg/v1/fill/w_1000,h_563,al_c,q_85,usm_0.66_1.00_0.01/b805ce_69e1742e21ca4513b66f3961b43c3130~mv2.jpg",TRUE,2026-03-21
https://www.synozur.com/post/the-wonderful-world-of-mark-kashman,The Wonderful World of Mark Kashman,"Join us as we explore ""The Wonderful World of Mark Kashman"" with Mark Kashman, delving into the vibrant Microsoft 365 community and its upcoming conference.",Blog Posts,"https://static.wixstatic.com/media/b805ce_cd5dc976cd414b769421435208bcd72f~mv2.jpg/v1/fill/w_1000,h_563,al_c,q_85,usm_0.66_1.00_0.01/b805ce_cd5dc976cd414b769421435208bcd72f~mv2.jpg",TRUE,2026-03-21
https://www.synozur.com/post/upgrading-your-company-operating-system-2026-from-ambition-to-execution,Upgrading Your Company Operating System (2026): From Ambition to Execution,"The 2026 edition of Upgrading Your Company Operating System explains why strategy alone isn’t enough—and how durable execution requires a system. This update introduces ambitions as long term north stars, reframes annual goals as executable objectives, and shows how a clear cascade from ambition to action prevents drift. It also introduces Vega, an AI augmented Company OS built to make strategy operational.",Blog Posts,"https://static.wixstatic.com/media/b805ce_daeba1847b08463bbc13e4eeb1bd5345~mv2.jpeg/v1/fill/w_1000,h_667,al_c,q_85,usm_0.66_1.00_0.01/b805ce_daeba1847b08463bbc13e4eeb1bd5345~mv2.jpeg",TRUE,2026-03-21
https://www.synozur.com/post/using-ai-maturity-to-drive-roi,Using AI Maturity to Drive ROI,"The Synozur AI Maturity Model, unveiled at Microsoft’s Times Square Experience Center during Experts Live USA, empowers organizations to align AI with strategy, enhance governance, and accelerate team upskilling. Access the free, instant PDF for actionable insights and guidance to drive your AI transformation journey—no login required.",Blog Posts,"https://static.wixstatic.com/media/b805ce_9b0bf2ff6fab44c7ad95e9db308fc201~mv2.png/v1/fill/w_806,h_588,al_c,lg_1,q_90/b805ce_9b0bf2ff6fab44c7ad95e9db308fc201~mv2.png",TRUE,2026-03-21
https://www.synozur.com/post/welcoming-michelle-boyd-as-executive-director-first-nations-ai-digital-futures-initiative,"Welcoming Michelle Boyd as Executive Director, First Nations AI & Digital Futures Initiative","Synozur is proud to announce the appointment of Michelle Boyd as Executive Director, First Nations AI & Digital Futures Initiative. A proven transformation and program leader, Michelle brings deep experience delivering complex digital initiatives and measurable business outcomes. In this role, she will work alongside Native American tribes and tribal leaders to co‑create responsible, community‑centered AI and digital futures.",Blog Posts,"https://static.wixstatic.com/media/b805ce_27fc26251b6540da9ffae6b10e174ac9~mv2.png/v1/fill/w_1000,h_1000,al_c,q_90,usm_0.66_1.00_0.01/b805ce_27fc26251b6540da9ffae6b10e174ac9~mv2.png",TRUE,2026-03-21
https://www.synozur.com/post/when-founders-stop-dreaming-and-what-it-costs-their-companies,When Founders Stop Dreaming-and What It Costs Their Companies,"Founders often get trapped in quarterly targets and lose sight of the decade they set out to build. Real momentum comes from balancing three horizons: long term ambition, annual goals, and quarterly execution. When leaders reconnect with their original vision and translate it into this year’s priorities, the quarter stops driving the company—and starts delivering the future. Vega helps operationalize this structure, but the clarity starts with leaders.",Blog Posts,"https://static.wixstatic.com/media/b805ce_597f693b52f940b388ea2e3af675c3ed~mv2.jpeg/v1/fill/w_1000,h_500,al_c,q_85,usm_0.66_1.00_0.01/b805ce_597f693b52f940b388ea2e3af675c3ed~mv2.jpeg",TRUE,2026-03-21
https://www.synozur.com/services/experiences,Experience Transformation | The Synozur Alliance,"Experience TransformationOur Experience Transformation services encompass a comprehensive suite of capabilities designed to optimize processes, enhance employee engagement, and drive innovation. Our approach is strategic, innovative, and tailored to meet your unique needs of each client.Optimizing Engagement Across the Employee LifecycleSynozur’s Experience Transformation offering is designed to revolutionize the way organizations approach process optimization, employee engagement, and leadership development. By leveraging our comprehensive suite of services, companies can achieve transformative results that drive performance and growth.

Employee Strategies
We develop engagement strategies that prioritize employee experience, UX design, and strategic communication initiatives. Our expertise includes intranet design, website UX, and comprehensive experience design strategies.

Communication Strategies
Effective communication is vital for organizational success. We create tailored communication strategies and plans that align with company goals and enhance employee engagement.Employee StrategiesWe create strategies that elevate the employee experience, blending UX design, communication, and engagement practices. It's all about supporting your people on every step of their journey.People Strategy
Communication StrategiesWe develop communication plans that connect your teams, support change, and reinforce your company’s mission. Our strategies are tailored, intentional, and designed to enhance engagement.Comms Approach
Design StrategiesFrom UX to intranets to web, we craft digital experiences that engage and empower. Our design strategies blend aesthetics with functionality, always grounded in the needs of your people.Explore Design Strategy
ResourcesWEBINARTransforming Your Digital WorkplaceMichelle Caldwell from Synozur and Ed Rogers from Akumina discuss the importance of internal communications, strategies for driving employee engagement, and the role of AI in the d",Services,"https://static.wixstatic.com/media/b805ce_7a5d9f47e6df42c6a2dab307ce8c4cf3~mv2.png/v1/fill/w_231,h_63,al_c,q_85,usm_0.66_1.00_0.01,enc_avif,quality_auto/SA-Logo-Horizontal-color.png",TRUE,2026-03-21
https://www.synozur.com/services/go-to-market-transformation,Go-To-Market Transformation | The Synozur Alliance,"Go-To-Market TransformationWe analyze your market strategies and develop go-to-market plans and campaigns that align with your business goals. We also provide brand transformation, design operations, campaign execution, event management, coaching, and team building.

Often, we can redefine marketing messaging and positioning, testing new approaches and introducing them to the right audiences and agencies. And if you’re a channel partner, we’re here to assist with channel development and maintain strong relationships within the Microsoft partner ecosystem.Transforming Capabilities Into Market SuccessIn today's rapidly evolving landscape, marketing is undergoing a monumental transformation, paving the way for innovative strategies and redefining what it means to achieve success. Marketing connects markets to products and brings products to markets. It turns your capabilities into businesses.

Marketing excellence can be a game-changer for businesses, as it drives brand recognition, customer loyalty, and revenue growth. By excelling in marketing, companies can effectively communicate their value proposition, differentiate themselves from competitors, and build lasting relationships with their target audience.Brand and MessagingWe help define and position your brand through messaging frameworks that resonate. Our work ensures your identity stands out in a crowded market—clear, compelling, and aligned to your values.Brand Strategy
GTM Strategy and ExecutionWe create structured rhythms and go-to-market strategies that drive product adoption, market presence, and long-term growth. Our approach ensures your message reaches the right audience at the right time.Launch Strategy
Microsoft Partner DevelopmentWe help you navigate the Microsoft partner ecosystem—building strong relationships, aligning to Microsoft’s GTM strategy, and unlocking co-sell opportunities. Our deep ecosystem knowledge ensures your partnership drives real results.Explore MSFT Growth
ResourcesCASE STUDYGo‑",Services,"https://static.wixstatic.com/media/b805ce_7a5d9f47e6df42c6a2dab307ce8c4cf3~mv2.png/v1/fill/w_231,h_63,al_c,q_85,usm_0.66_1.00_0.01,enc_avif,quality_auto/SA-Logo-Horizontal-color.png",TRUE,2026-03-21
https://www.synozur.com/services/strategic-transformation,Organizational Transformation | The Synozur Alliance,"Organizational TransformationSynozur works in concert with your leadership team to develop new business strategies and management frameworks to optimize and elevate your effectiveness. We help our customers implement new company operating systems and detailed adoption strategies tailored to their specific organizational and cultural needs.

Our approach involves defining and refining your company’s foundations - mission, purpose, values, and goals. Strategy and planning are separate components. We facilitate leadership decisions that form your strategy and assist with the annual planning required to implement them.Clarifying Strategic Direction and Tactical ExecutionThere is no such thing as ""strategic planning"".

Strategy and planning are often confused, but they are fundamentally different. Strategy involves making choices where the outcomes are beyond your control, such as deciding to expand your product lines or entering a new market. These strategic decisions set the direction for your business and require a long-term vision.

On the other hand, planning involves the specific tactics and actions you will take to execute your strategy, such as organizing a customer training event or launching a marketing campaign. Planning is about determining the steps and resources needed to achieve your strategic goals.

Objectives and Key Results (OKRs) are tools used to measure the success of your strategies. They provide a framework for setting and tracking goals, but they do not need to encapsulate every tactical activity within the company. Instead, OKRs focus on the key outcomes that drive your strategic objectives forward.Company OSA Company Operating System aligns your purpose, goals, and execution strategy into a unified model. We help you implement this framework to improve clarity, accountability, and operational performance across your organization.Explore Company OS
Fractional LeadershipFractional CxOs bring high-impact leadership when and where it’s needed most.",Services,"https://static.wixstatic.com/media/b805ce_7a5d9f47e6df42c6a2dab307ce8c4cf3~mv2.png/v1/fill/w_231,h_63,al_c,q_85,usm_0.66_1.00_0.01,enc_avif,quality_auto/SA-Logo-Horizontal-color.png",TRUE,2026-03-21
https://www.synozur.com/services/technology-transformation,Technology Transformation | The Synozur Alliance,"Technology TransformationSynozur develops technology strategies that align with your business ambitions, working in concert with your leadership team to develop new plans to maximize innovation and ROI.Synchronizing Innovation with Business StrategyIn today's rapidly evolving business landscape, having an aligned roadmap for technology that matches your business strategy is crucial for success.

An aligned roadmap ensures that your technology investments are directly supporting your business objectives, leading to more efficient operations, enhanced customer experiences, and a competitive edge in the market. It helps in prioritizing initiatives that drive the most value, avoiding unnecessary expenditures on redundant tools, and ensuring that every piece of technology in your arsenal is essential and impactful.

By aligning technology with business strategy, companies can foster innovation, improve agility, and achieve sustainable growth, positioning themselves for long-term success.Strategic RoadmapsWe co-create strategic roadmaps that align your vision with actionable steps—leveraging your current tools and identifying what’s truly needed. It's a pragmatic path toward smarter, more sustainable technology choices.Explore Roadmaps
AI Strategy and DesignWe bring clarity and purpose to AI, aligning tools like Copilot with meaningful business outcomes. From ethical design to pilot programs, we help you chart a course that blends innovation with human impact.View AI Approach
Employee EffectivenessWe focus on the people behind the platforms—improving the employee experience through smarter communication, collaboration, and adoption strategies. Our goal: a modern workplace where productivity and satisfaction go hand in hand.Boost Productivity
ResourcesCASE STUDYAI & Governance Acceleration for Private EquityA private equity firm partnered with Synozur to rapidly accelerate AI readiness while strengthening governance, security, and executive alignment.Read More
CASE STUDYEx",Services,"https://static.wixstatic.com/media/b805ce_7a5d9f47e6df42c6a2dab307ce8c4cf3~mv2.png/v1/fill/w_231,h_63,al_c,q_85,usm_0.66_1.00_0.01,enc_avif,quality_auto/SA-Logo-Horizontal-color.png",TRUE,2026-03-21
https://www.synozur.com/solutions/company-os,Company OS | The Synozur Alliance,"A Company Operating System aligns your purpose, goals, and execution strategy into a unified model. We help you implement this framework to improve clarity, accountability, and operational performance across your organization.",Services,"https://static.wixstatic.com/media/b805ce_7a5d9f47e6df42c6a2dab307ce8c4cf3~mv2.png/v1/fill/w_231,h_63,al_c,q_85,usm_0.66_1.00_0.01,enc_avif,quality_auto/SA-Logo-Horizontal-color.png",TRUE,2026-03-21
https://www.synozur.com/webinars/business-strategy-masterclass,Business Strategy Masterclass | The Synozur Alliance,"WebinarsSynozur is proud to offer our library of on-demand webinars and resources to help guide your business transformation.Business Strategy MasterclassIn our recent Business Strategy Masterclass webinar, Synozur expert Matt Shaffer explored why so many companies struggle to execute strategy effectively—and how a structured Company Operating System (CoS) can bridge the gap between ambitious plans and tangible results. We’ll also point you to resources to watch the recording and get started in your own organization.

As we learned in the masterclass, a bit of structure and intentional focus can unlock tremendous value — turning strategy from a buzzword into a daily practice that drives growth. Here’s to making strategy execution a strength, not a struggle, in your company.
 Resources: Presentation DeckCompany OS Maturity Model ToolkitWatch the Business Strategy Masterclass recording and visit our Company OS solution page for more information. If you have any questions or want to explore this further, contact Synozur – we’re excited to guide you on your transformation journey.",Services,"https://static.wixstatic.com/media/b805ce_7a5d9f47e6df42c6a2dab307ce8c4cf3~mv2.png/v1/fill/w_231,h_63,al_c,q_85,usm_0.66_1.00_0.01,enc_avif,quality_auto/SA-Logo-Horizontal-color.png",TRUE,2026-03-21
