URL,Title,Description,Category,Image URL,ACTIVE,Captured
https://www.synozur.com,Synozur,"Synozur is the transformation company — a woman-owned advisory firm helping organizations find their North Star through AI strategy, leadership, and Microsoft 365.",Service,"https://static.wixstatic.com/media/b805ce_53dcd08840e343b18f38c04258086404%7Emv2.png/v1/fit/w_2500,h_1330,al_c/b805ce_53dcd08840e343b18f38c04258086404%7Emv2.png",TRUE,2026-03-21
https://www.synozur.com/models/ai-maturity-model,Synozur AI Maturity Model,"Evaluate your organization's AI readiness and maturity across key dimensions including strategy, infrastructure, talent, and implementation capabilities.",Model,"https://static.wixstatic.com/media/b805ce_9027f93fb21340c1b3f7a9e25b1f832b~mv2.jpeg/v1/fill/w_4624,h_2589,al_c,q_90/AdobeStock_1238508882.jpeg",TRUE,2026-03-21
https://orion.synozur.com/ai-maturity,Orion AI Maturity Assessments | The Synozur Alliance,Science-backed digital transformation assessments trusted by leading enterprises. Assess your organization's maturity across multiple dimensions.,Model,https://models.synozur.com/og-image.jpg,TRUE,2026-03-21
https://orbit.synozur.com/,Orbit Competitive Market Analysis | The Synozur Alliance,AI-driven marketing intelligence platform for The Synozur Alliance LLC.,Apps,https://synozur-orbit-prod.replit.app/opengraph.jpg,TRUE,2026-03-21
https://orion.synozur.com/,Orion Digital Transformation Assessments | The Synozur Alliance,Science-backed digital transformation assessments trusted by leading enterprises. Assess your organization's maturity across multiple dimensions.,Apps,https://models.synozur.com/og-image.jpg,TRUE,2026-03-21
https://vega.synozur.com/,Vega - The Synozur Alliance Company OS,Vega delivers the ultimate Company Operating System experience. Designed by former Microsoft Viva product leadership.,Apps,https://vega.synozur.com/og-image.png?v=2,TRUE,2026-03-21
https://www.synozur.com/,Transform Your Business with The Synozur Alliance | Strategic Advisory Services,"Synozur is the transformation company — a woman-owned advisory firm helping organizations find their North Star through AI strategy, leadership, and Microsoft 365.",About,"https://static.wixstatic.com/media/b805ce_53dcd08840e343b18f38c04258086404%7Emv2.png/v1/fit/w_2500,h_1330,al_c/b805ce_53dcd08840e343b18f38c04258086404%7Emv2.png",TRUE,2026-03-21
https://www.synozur.com/applications/constellation,Constellation | The Synozur Alliance,"Constellation is Synozur’s AI‑powered Consulting Delivery Platform, purpose-built for professional services organizations and designed to improve execution quality, delivery confidence, and leadership decision‑making across engagements. By unifying project delivery, financials, and operational data inside the Microsoft 365 ecosystem, Constellation gives leaders a real‑time, trustworthy view of status, deliverables, risks, issues, and costs—without relying on manual reporting or disconnected tools. 

AI capabilities built on Microsoft AI Foundry continuously synthesize live system data to generate clear status reports, highlight delivery risk, surface emerging issues, and produce executive‑ready narratives and artifacts stored directly in SharePoint Embedded and accessible through Teams. Constellation tracks deliverables end‑to‑end, links work progress to financial performance, and makes accountability explicit—so teams spend less time assembling updates and more time addressing what matters. Tasks are synchronized to Outlook and Planner, and Constellation's AI agent integrates directly into M365 Copilot for ease of use.

With deep Microsoft alignment, CRM integration, and Copilot‑ready data access, Constellation turns delivery operations into a predictable, transparent system that helps organizations stay on track, manage risk proactively, and keep execution aligned to strategy as work unfolds.",Apps,"https://static.wixstatic.com/media/b805ce_f13ce62d083e4111a33c355746cb292b~mv2.jpeg/v1/fill/w_4679,h_3120,al_c,q_90/AdobeStock_244105520.jpeg",TRUE,2026-03-21
https://www.synozur.com/applications/holidays-and-birthdays-web-part,Holidays and Birthdays Web Part | The Synozur Alliance,"Project Comet is a small but meaningful way to make work more human. It brings holidays and birthdays into everyday view across SharePoint and Viva Connections—helping organizations pause, rest, and celebrate the people who make the work possible. Designed to deploy in minutes and managed entirely through standard SharePoint lists and permissions, Project Comet removes friction for administrators while creating moments of recognition and connection for employees. Built as an open, community‑first solution and shared freely with no licensing or paywalls, Project Comet is our gift back to the SharePoint community—a reminder that great digital workplaces don’t just help us work better, they help us care for one another too.",Apps,"https://static.wixstatic.com/media/b805ce_a49c1db64df24772bd68da04fc5c540c~mv2.jpg/v1/fill/w_144,h_144,al_c,q_80/default-holiday_a6565966acb6a0ae2a6593819479c31f.jpg",TRUE,2026-03-21
https://www.synozur.com/applications/nebula,Nebula | The Synozur Alliance,"Nebula is Synozur's collaborative envisioning platform — built for facilitators who need to do more than just run a workshop. Bring together teams, customers, or stakeholders in structured real-time sessions where ideas are surfaced, categorized by AI, and prioritized through voting, ranking, and visual frameworks like the 2×2 priority matrix. Whether you're shaping a product strategy, exploring transformation priorities, or building shared direction across an organization, Nebula turns group input into clear, AI-generated insights and personalized results that participants can act on long after the session ends.",Apps,"https://static.wixstatic.com/media/b805ce_79a13b0c9bda4d6bb2018308edd7449d~mv2.jpg/v1/fill/w_2406,h_2411,al_c,q_90/aldebaran-s-uXchDIKs4qI-unsplash.jpg",TRUE,2026-03-21
https://www.synozur.com/applications/orbit,Orbit | The Synozur Alliance,"Orbit is Synozur’s go‑to‑market intelligence platform that turns competitive insight into ready‑to‑use execution assets. Orbit continuously monitors market signals, competitor positioning, news, and messaging shifts—then automatically generates and refreshes GTM outputs such as Messaging & Positioning Frameworks (MPFs), one‑sheet sell sheets, and sales battlecards aligned to what’s happening in the market right now. Instead of static research or outdated decks, Orbit gives teams a living GTM system—combining ongoing competitive intelligence with auto‑generated, execution‑ready materials that help marketing, product, and sales adapt faster, sharpen differentiation, and win with confidence.",Apps,"https://static.wixstatic.com/media/b805ce_450e05c49ec64b23aa6f554f9a294071~mv2.jpg/v1/fill/w_1920,h_1080,al_c,q_90/IMG_7169.JPG",TRUE,2026-03-21
https://www.synozur.com/applications/orion,Orion | The Synozur Alliance,"Transformation is hard.

Most organizations know their ambitions, but the journey from today’s reality to tomorrow’s outcomes is complex, uncertain, and often overwhelming. Orion is built to bridge that gap — giving you clarity, confidence, and a path forward that’s tailored to your unique context. Measurement and benchmarking are crucial.

Orion is Synozur’s AI‑powered transformation platform that applies our deep expertise—frameworks, research, and real‑world advisory experience—at scale. Rather than delivering generic assessments, Orion integrates AI to interpret your organization’s unique context, synthesizing your data with Synozur’s proven models to produce personalized results you can trust. 

It translates insight into a tailored view of your current state, then delivers role‑specific recommendations, prioritized actions, and curated resources aligned to your industry, maturity, and goals. By combining human expertise with AI‑driven analysis, Orion moves organizations beyond static reports—providing clear guidance, practical next steps, and the confidence to act with clarity as transformation unfolds.",Apps,"https://static.wixstatic.com/media/b805ce_577b66e3923b4a86b84f77fd4f591078~mv2.jpg/v1/fill/w_1280,h_720,al_c,q_85/Orion%20Wide.jpg",TRUE,2026-03-21
https://www.synozur.com/applications/vega,Vega | The Synozur Alliance,"Vega is your AI-powered Company Operating System that turns strategy into action every day. It unifies mission, priorities, OKRs, and meetings into a single operating rhythm—bringing clarity, cadence, and accountability to your organization. With seamless Microsoft 365 integration, enterprise-grade security, and intelligent AI guidance that augments human judgment, Vega helps leaders align teams, track progress, and accelerate outcomes without the chaos of disconnected tools.",Apps,"https://static.wixstatic.com/media/b805ce_4161e81837b14710ad0874cb7f91bbba~mv2.png/v1/fill/w_1500,h_1500,al_c/VegaTight.png",TRUE,2026-03-21
https://www.synozur.com/applications/zenith,Zenith | The Synozur Alliance,"Zenith is Synozur’s centralized governance control plane for Microsoft 365, built for IT leaders, governance teams, and managed service providers operating complex, multi‑tenant environments. It unifies workspace visibility, automated policy evaluation, sensitivity and retention alignment, and Copilot readiness tracking into a single, secure system—eliminating reliance on scripts, manual audits, and fragmented tools. 

Zenith integrates with Microsoft Entra ID for tenant‑isolated identity, multi‑factor authentication, and granular role‑based access control, ensuring the right users have the right visibility at the right time. Governance decisions are written directly back into SharePoint so Microsoft Purview can enforce policies natively, creating a closed loop between governance intent and day‑to‑day operations. 

Hosted in SOC 2 Type II–certified data centers and designed for enterprise‑grade security and auditability, Zenith helps organizations govern at scale, reduce risk, and confidently prepare their Microsoft 365 environments for Copilot and future AI adoption.",Apps,"https://static.wixstatic.com/media/b805ce_64ac1f32ded24141bf2b8136c6e64780~mv2.jpeg/v1/fill/w_6000,h_3301,al_c,q_90/AdobeStock_382432785.jpeg",TRUE,2026-03-21
https://www.synozur.com/case-studies/accelerating-go-to-market-for-a-leading-ai-isv,Accelerating Go-To-Market for a leading AI ISV | The Synozur Alliance,"Our client, a leading independent software vendor (ISV), developed an app for generative AI systems like Microsoft Copilot to integrate disconnected content. Synozur was engaged for fractional product and marketing leadership to drive mew messaging, new app designs, and strategic go-to-market plans, recruiting sales leaders and mentoring staff to drive a successful product launch. As a result they achieved an estimated $0.8M–$1.2M incremental revenue over 12–24 months and $250K–$500K in cost avoidance, enabled by accelerated go‑to‑market execution, clearer positioning, and higher early‑stage conversion.",Case Studies,"https://static.wixstatic.com/media/b805ce_03dd23de63224d67a613ec1398ab3143~mv2.jpeg/v1/fill/w_6720,h_4480,al_c,q_90/AdobeStock_456986840.jpeg",TRUE,2026-03-21
https://www.synozur.com/case-studies/ai-%26-governance-acceleration-for-private-equity,AI & Governance Acceleration for Private Equity | The Synozur Alliance,"A private equity firm partnered with Synozur to rapidly accelerate AI readiness while strengthening governance, security, and executive alignment.",Case Studies,"https://static.wixstatic.com/media/b805ce_a67e17e43687429ebb2e6bffe60af815~mv2.jpeg/v1/fill/w_6627,h_4418,al_c,q_90/AdobeStock_502007078.jpeg",TRUE,2026-03-21
https://www.synozur.com/case-studies/ai-and-knowledge-transformation-at-a-strategic-communications-firm,AI and Knowledge Transformation at a Strategic Communications Firm | The Synozur Alliance,"A fast‑growing strategic communications firm partnered with Synozur to define an AI strategy and modernize knowledge workflows—without disrupting creative teams or compromising trust with clients. The goal was not AI for AI’s sake, but a people‑first approach that made work easier, faster, and more consistent.",Case Studies,"https://static.wixstatic.com/media/b805ce_f65fdc00c3454ea18cd14419a17d0de7~mv2.jpeg/v1/fill/w_7928,h_4899,al_c,q_90/AdobeStock_525215214.jpeg",TRUE,2026-03-21
https://www.synozur.com/case-studies/ai-transformation-at-a-private-equity-portfolio-company,AI Transformation at a Private Equity Portfolio Company | The Synozur Alliance,"A financial‑services portfolio company of a leading private equity firm engaged Synozur to shift from scattered AI experiments to governed, measurable outcomes at enterprise scale. Building on patterns we’ve proven in similar programs, we turned real documents and workflows into a prioritized use‑case backlog, stood up a practical governance model, and upskilled leaders and makers through a multi‑tool curriculum. As a result, they achieved an estimated $250K–$500K annual cost savings and $500K–$1.0M+ EBITDA uplift, driven by faster decision‑making, reduced duplicated analysis, and improved execution discipline across leadership and operations.",Case Studies,"https://static.wixstatic.com/media/b805ce_216de3dbbef94823a2eecb2d3a72bf2b~mv2.jpg/v1/fill/w_2172,h_1313,al_c,q_90/AdobeStock_151524961Small.jpg",TRUE,2026-03-21
https://www.synozur.com/case-studies/energy-company-reinvents-employee-expereince-and-effectiveness,Energy company reinvents employee experience and effectiveness | The Synozur Alliance,"A North American energy company, facing substantial challenges in employee engagement and communication for their 12,000+ employees, engaged Synozur to revamp their approach. Synozur conducted detailed employee journey mapping and developed personalized, relevant tools and information to improve user experience, addressing issues with the outdated intranet and poor engagement tools. As a result, they saw an estimated $2.0M–$6.0M in annual productivity gains, based on reduced information‑search time, streamlined internal communications, and improved employee engagement across a 12,000+ employee workforce.",Case Studies,"https://static.wixstatic.com/media/b805ce_d48bad9f6faa40e58e764f1ead186a5a~mv2.jpg/v1/fill/w_2000,h_1333,al_c,q_90/Ofc17_Truck_Sonia_001.jpg",TRUE,2026-03-21
https://www.synozur.com/case-studies/executive-ai-readiness-at-a-leading-education-technology-company,Executive AI Readiness at a Leading Education Technology Company | The Synozur Alliance,"A leading education technology organization partnered with Synozur to assess AI readiness, align leadership, and define a practical roadmap for responsible AI adoption.",Case Studies,"https://static.wixstatic.com/media/b805ce_3c46f10e30d6494f9961c3c265212750~mv2.jpeg/v1/fill/w_5472,h_3204,al_c,q_90/AdobeStock_670678012.jpeg",TRUE,2026-03-21
https://www.synozur.com/case-studies/go%E2%80%91to%E2%80%91market-transformation-for-a-microsoft%E2%80%91aligned-software-company,Go-to-Market Transformation for a Microsoft-Aligned Software Company | The Synozur Alliance,"A Microsoft‑aligned software company partnered with Synozur to clarify its go‑to‑market strategy, sharpen messaging, align to Microsoft, and strengthen partner engagement.",Case Studies,"https://static.wixstatic.com/media/b805ce_03ce5f0a768b4717b69e003ba4760efa~mv2.jpeg/v1/fill/w_6240,h_4160,al_c,q_90/AdobeStock_249826261.jpeg",TRUE,2026-03-21
https://www.synozur.com/case-studies/management-makeover-at-a-luxury-brand,Management Makeover at a Luxury Brand | The Synozur Alliance,"In a strategic effort to overhaul the management framework of a thriving North American luxury manufacturer, Synozur spearheaded a digital transformation initiative in 2023. The project's primary objective was to implement a robust Company Operating System (Company OS) to support the company's rapid growth and scalability. This case study delves into the challenges faced, the solutions introduced by Synozur, and the positive outcomes for leadership effectiveness. As a result, our client saw an estimated $0.6–$1.3MM annual cost savings and $500K–$1.5M+ in revenue enablement, driven by reduced internal friction and faster execution of commercial and operational initiatives.",Case Studies,"https://static.wixstatic.com/media/b805ce_3367a960d2474a518ab816eacdff0891~mv2.jpg/v1/fill/w_1067,h_760,al_c,q_85/CLO17_corporateOffice_021%20-cropped.jpg",TRUE,2026-03-21
https://www.synozur.com/case-studies/story-cellars,Story Cellars and Synozur - Craft and Culture | The Synozur Alliance,"Story Cellars was founded in 2016 by Tim Oas. Tim is a pioneer in crafting Washington state wines from their winery in Woodinville, Washington. We chose to partner with Story Cellars because we believe in Tim and love his approach to winemaking. The Velvet Vega Zin has been a labor of love for Tim and a great partnership for us.",Case Studies,"https://static.wixstatic.com/media/b805ce_7aa5db4e2dbc41eeb703c838bb75db8f~mv2.png/v1/fill/w_1500,h_970,al_c/IMG_4464.PNG",TRUE,2026-03-21
https://www.synozur.com/case-studies/transforming-management-frameworks-at-microsoft,Transforming management frameworks at Microsoft | The Synozur Alliance,"When one of Microsoft’s marketing teams sought to reinvent their annual planning “offsite” to establish new goals and a more dynamic and efficient management framework, they turned to Synozur, a leader in strategic consulting. Synozur’s expertise played a pivotal role in revolutionizing Microsoft’s management processes, enhancing team productivity, and fostering innovation. As a result, Microsoft saw an estimated $0.5M–$1.0M in annual productivity cost avoidance, with additional multi‑million‑dollar revenue influence, resulting from improved planning cadence, cross‑team alignment, and faster marketing execution.",Case Studies,"https://static.wixstatic.com/media/b805ce_759217ee0d84438089805ae72a743c3a~mv2.jpg/v1/fill/w_2000,h_1333,al_c,q_90/Win16a_BCN_Students2_Table_HPSpectrex360_01416.jpg",TRUE,2026-03-21
https://www.synozur.com/items/2026-ai-report,Synozur 2026 AI Report | The Synozur Alliance,"The Synozur 2026 AI Report gives leaders a grounded view of AI's trajectory — from a $453B market today to $923B by 2030. Drawing on 120 maturity assessments, it reveals why most organizations stall at adoption, not tools. Plus three predictions shaping 2026: Microsoft's first-party LLM, the Agent Boss era, and industry-led governance standards. Cut through the hype at synozur.com.",White Paper,"https://static.wixstatic.com/media/b805ce_597f693b52f940b388ea2e3af675c3ed~mv2.jpeg/v1/fill/w_5110,h_2555,al_c,q_90/AdobeStock_307252854.jpeg",TRUE,2026-03-21
https://www.synozur.com/items/care-raft-prompting-industry-examples,CARE-RAFT Prompting - Industry Examples | The Synozur Alliance,"The CARE and RAFT frameworks are designed to enhance prompt engineering for generative AI. CARE helps define the situation, clarify the intended action, outline rules for output, and provide concrete examples. RAFT, on the other hand, ensures the AI understands its role, audience, output format, and the specific task required. Both frameworks empower users to create clearer, more effective prompts.",White Paper,"https://static.wixstatic.com/media/b805ce_09efecc1c63b4e3b99d791bcbb81331d~mv2.jpg/v1/fill/w_1536,h_1024,al_c,q_85/CARE-RAFT.jpg",TRUE,2026-03-21
https://www.synozur.com/items/navigating-ai-stratosphere,Navigating the AI Stratosphere | The Synozur Alliance,"Worried about crashing your AI project? Get the altitude you need to fly over storms and reach new business heights with AI! Based on research from Microsoft and Synozur, and decades of consulting expertise, we'll show you how to prepare and execute your GenAI flight plan. We review findings from the 2024 Microsoft WTI and our own research.",White Paper,"https://static.wixstatic.com/media/b805ce_c70a4176862e49efa027e2945a7b2973~mv2.png/v1/fill/w_1792,h_1024,al_c/FlyingOutOfStorm.png",TRUE,2026-03-21
https://www.synozur.com/items/succeeding-with-copilot,Succeeding with Your Copilot Rollout | The Synozur Alliance,"In February, Chris McNulty led a comprehensive webinar titled “How to Succeed with Your Copilot Deployment."" The session provided invaluable insights and practical steps for effectively deploying Microsoft's Copilot within organizations. Attendees were guided through the current state of AI, common deployment mistakes, and a five-step plan for successful Copilot integration.",White Paper,"https://static.wixstatic.com/media/b805ce_dbe6b0efcca946d7aad7ec510864b2d5~mv2.jpeg/v1/fill/w_2688,h_1536,al_c,q_90/Firefly_219baa39-8237-499a-8c56-b2dba071fbc5.jpeg",TRUE,2026-03-21
https://www.synozur.com/items/upgrading-your-company-operating-system-2026,Upgrading your Company Operating System (Updated) | The Synozur Alliance,"Strong strategy fails without a system. The 2026 edition of Upgrading Your Company Operating System shows modern organizations how to scale with clarity and discipline — turning ambitions into executable goals, preventing execution drift, and building a management cadence that lasts. Includes a practical maturity model and a look at Vega, Synozur's AI-augmented Company Operating System. Try Vega free at vega.synozur.com",White Paper,"https://static.wixstatic.com/media/b805ce_daeba1847b08463bbc13e4eeb1bd5345~mv2.jpeg/v1/fill/w_4100,h_2733,al_c,q_90/AdobeStock_299078039.jpeg",TRUE,2026-03-21
https://www.synozur.com/models/content-management-maturity-model,Content Management Maturity Model | The Synozur Alliance,"Evaluate your organization's content and document management maturity across leadership, people, technology, processes, GRC, and AI capabilities. Platform-agnostic framework with Microsoft 365 examples.",Models,"https://static.wixstatic.com/media/b805ce_9a2084eef48c4f90ba8406b5c809eff7~mv2.jpeg/v1/fill/w_2688,h_1536,al_c,q_90/Firefly_5c02a715-05d7-48e2-91d7-99c03988b690.jpeg",TRUE,2026-03-21
https://www.synozur.com/models/gtm-maturity-model,GTM Maturity Model | The Synozur Alliance,"The Go-To-Market (GTM) Maturity model measures how ready your organization is to scale by evaluating its approach to launching and selling products—covering market fit, brand clarity, pricing strategy, demand generation, sales enablement, and collateral effectiveness.",Models,"https://static.wixstatic.com/media/b805ce_610645951fa747adaad22b93eb3c8dd9~mv2.png/v1/fill/w_614,h_409,al_c/GTMNight.png",TRUE,2026-03-21
https://www.synozur.com/models/knowledge-management-maturity-model,Knowledge Management Maturity Model | The Synozur Alliance,"Assess your organization's knowledge management maturity across leadership, culture, processes, technology, risk/compliance, and use of AI. This model is aligned with industry best practices (APQC, CMMI, ISO 30401) and provides a 5-level maturity evaluation.",Models,"https://static.wixstatic.com/media/b805ce_c47dfecd3ac74431be4ec2e9b2e234ea~mv2.jpeg/v1/fill/w_2500,h_1667,al_c,q_90/AdobeStock_371497878.jpeg",TRUE,2026-03-21
https://www.synozur.com/models/management-and-company-os,Management and Company OS | The Synozur Alliance,"Evaluate how effectively your organization runs — from mission and goals to strategy, management rhythm, and execution. A fast, structured assessment that shows you where your Company Operating System stands and where to go next.",Models,"https://static.wixstatic.com/media/b805ce_ce184f8f253d449998f9017fec96d76c~mv2.png/v1/fill/w_1456,h_816,al_c/u8445749678_To_promote_Synozurs_podcast_show_a_photorealistic_2c893074-08b9-47a6-89b8-237fdc7b230d_3.png",TRUE,2026-03-21
https://www.synozur.com/post/ai-in-2026-the-market-is-big-the-gap-is-bigger,AI in 2026: The Market Is Big. The Gap Is Bigger.,"AI is past experimentation—and the gap between leaders and laggards is widening. The Synozur 2026 AI Report delivers a clear view of AI market growth from $453B in 2026 to ~$923B by 2030, insights from 120 maturity assessments showing a 250+ point gap, and three practical predictions shaping 2026 around models, agents, and standards.",Blog Posts,"https://static.wixstatic.com/media/b805ce_17d6e552966f4a03b382c3da21b732d7~mv2.png/v1/fill/w_1000,h_667,al_c,q_90,usm_0.66_1.00_0.01/b805ce_17d6e552966f4a03b382c3da21b732d7~mv2.png",TRUE,2026-03-21
https://www.synozur.com/post/ai-in-nonprofits-force-multipliers-human-values,"AI in Nonprofits: Force Multipliers, Human Values","How AI is reshaping nonprofits—from back office productivity and research “force multipliers” to ethical guardrails, governance, and the human connections that keep members engaged.",Blog Posts,"https://static.wixstatic.com/media/b805ce_ed3eb408fc184d7db2ef71de88f92913~mv2.jpg/v1/fill/w_1000,h_563,al_c,q_85,usm_0.66_1.00_0.01/b805ce_ed3eb408fc184d7db2ef71de88f92913~mv2.jpg",TRUE,2026-03-21
https://www.synozur.com/post/building-delight-inside-microsoft-product-management,Building Delight - Inside Microsoft Product Management,"In our latest Polaris episode, I sat down with Sean Squires to demystify what product managers at Microsoft really do. We explored how a product manager blends technical know-how, business strategy, and deep customer empathy to turn ideas into features that millions use and love. Sean is a Principal Product Manager focusing on SharePoint and Content AI at Microsoft, and his insights offered a behind-the-scenes look at how software gets from inspiration to innovation.We kicked off by framing the",Blog Posts,"https://static.wixstatic.com/media/b805ce_e9020d5ef95d4d94a0306bfc4c5d7c1e~mv2.jpg/v1/fill/w_1000,h_563,al_c,q_85,usm_0.66_1.00_0.01/b805ce_e9020d5ef95d4d94a0306bfc4c5d7c1e~mv2.jpg",TRUE,2026-03-21
