URL,Title,Description,Category,Image URL,ACTIVE,Captured
https://www.synozur.com/webinars/mastering-your-ai-rollout,Mastering Your AI Rollout | The Synozur Alliance,"WebinarsSynozur is proud to offer our library of on-demand webinars and resources to help guide your business transformation.Mastering Your AI RolloutMichelle Caldwell, CEO of Synozur and a seasoned expert in workplace transformation, spearheaded the ""Mastering Your AI Rollout"" webinar, offering attendees a comprehensive guide to deploying Microsoft 365 Copilot effectively. Drawing on her years of advising global enterprise clients and her partnership with Microsoft, she shared insights into strategic preparation, including defining vision statements, team evaluation, content readiness, and pilot program design. She underscored the importance of addressing common pitfalls such as inadequate training, scope creep, and lack of ongoing support.The session explored the structured phases of a successful AI rollout, providing attendees with actionable insights and practical strategies to ensure sustainable outcomes. Key recommendations included:Implementing pilot programs to test and refine strategies before scaling.Utilizing Microsoft tools like SharePoint Advanced Management, Purview and Viva to manage content, security, and communicationsFostering collaboration and measuring impact to maintain rollout momentum.This webinar is an invaluable resource for organizations at various stages of their AI adoption journey. Whether preparing for initial deployment or optimizing existing strategies, participants walked away equipped with actionable takeaways to drive meaningful change and measurable success in their Copilot implementations. The recorded session is now available on our website for those seeking to transform their AI rollout into a seamless and impactful initiative.

Mastering Your AI Rollout.pdfDownload PDF • 7.72MB",Services,"https://static.wixstatic.com/media/b805ce_7a5d9f47e6df42c6a2dab307ce8c4cf3~mv2.png/v1/fill/w_231,h_63,al_c,q_85,usm_0.66_1.00_0.01,enc_avif,quality_auto/SA-Logo-Horizontal-color.png",TRUE,2026-03-21
https://www.synozur.com/post/ai-in-2026-a-trillion-dollars-is-coming-who-wins,AI in 2026: A Trillion Dollars is Coming. Who Wins?,"A trillion-dollar AI market is coming — the real question is whether your organization will be ready to claim its share.

The Synozur 2026 AI Report reveals a striking gap: most organizations score around 260 out of 500 on AI maturity. That means they've moved past experimenting, but they're nowhere close to operating AI at scale. In a market projected to approach a trillion dollars by 2030, that middle-ground position is a risky place to sit still.

The latest episode of Polaris Pulse breaks down exactly where organizations stand on the AI maturity curve, what the global market growth actually means for business leaders, and three forward-looking predictions that could shape your strategy for the year ahead.

The window to move from ""exploring"" to ""leading"" is narrowing. Understanding where you are on the maturity curve — and what it takes to close the gap — is no longer optional. It's the difference between capturing value and watching others do it.",Blog Posts,"https://static.wixstatic.com/media/b805ce_3a72bdc0e29b475cbc506b23114640be~mv2.png/v1/fill/w_1000,h_563,al_c,q_90,usm_0.66_1.00_0.01/b805ce_3a72bdc0e29b475cbc506b23114640be~mv2.png",TRUE,2026-03-22
https://example.com/test,Test Page,,,,TRUE,2026-03-22