Post Content,Image URL,Date/Time,Account ID,First Comment,Tags
"What does exceptional wine and transformative business strategy have in common? Both require vision, patience, and an unwavering commitment to craft.

We're proud to partner with Story Cellars, a Woodinville, Washington winery founded by pioneer winemaker Tim Oas in 2016. Tim's approach to winemaking mirrors our philosophy at Synozur: every bottle tells a unique story, crafted with intention and tailored to deliver something truly exceptional.

Our collaboration on the Velvet Vega Zin embodies this shared commitment. Just as Tim carefully selects each varietal and honors the terroir of Washington state, we work closely with our clients to understand their unique journey and craft strategies that bring out their best.

Transformation isn't about following a formula—it's about listening, understanding, and creating something meaningful together. Whether it's a perfectly balanced Zinfandel or a company operating system that unlocks growth, the result should reflect the people behind it.

We believe in Tim's vision and his dedication to excellence. That's why this partnership is more than business—it's a celebration of craft, culture, and the stories we build together.

Learn more about our partnership: https://www.synozur.com/case-studies/story-cellars
#Transformation #Partnership #CraftCulture #BusinessStrategy #WashingtonWine
https://www.synozur.com/case-studies/story-cellars","https://static.wixstatic.com/media/b805ce_7aa5db4e2dbc41eeb703c838bb75db8f~mv2.png/v1/fill/w_1500,h_970,al_c/IMG_4464.PNG","","1761682","","Transformation;Partnership;CraftCulture;BusinessStrategy;WashingtonWine"
"Proud to partner with Story Cellars—where craftsmanship meets culture. Tim Oas pioneers Washington state wines with authenticity and purpose. Read their story:…
#Transformation #Partnership #Craftsmanship #Leadership
https://www.synozur.com/case-studies/story-cellars","https://static.wixstatic.com/media/b805ce_7aa5db4e2dbc41eeb703c838bb75db8f~mv2.png/v1/fill/w_1500,h_970,al_c/IMG_4464.PNG","","1761680","","Transformation;Partnership;Craftsmanship;Leadership"
"Great partnerships are built on shared values and mutual respect—just like great wine.

When we met Tim Oas, founder of Story Cellars, we knew we'd found a kindred spirit. Tim's been pioneering Washington state wines from his Woodinville winery since 2016, and his approach to winemaking mirrors our own philosophy: thoughtful craft, deep care, and a commitment to authenticity.

Our collaboration on the Velvet Vega Zin has been a labor of love—proof that when you align vision with execution, something remarkable emerges.

At Synozur, we believe transformation happens when strategy meets culture. Whether it's a bottle of Zinfandel or a business initiative, the best outcomes come from partnerships rooted in trust and a shared North Star.

Learn more about our work with Story Cellars: https://www.synozur.com/case-studies/story-cellars

What partnerships have shaped your journey? We'd love to hear your story.
#Partnership #CraftAndCulture #Transformation #BusinessStrategy #Synozur
https://www.synozur.com/case-studies/story-cellars","https://static.wixstatic.com/media/b805ce_7aa5db4e2dbc41eeb703c838bb75db8f~mv2.png/v1/fill/w_1500,h_970,al_c/IMG_4464.PNG","","1764931","","Partnership;CraftAndCulture;Transformation;BusinessStrategy;Synozur"
"Great wine is about more than technique—it's about vision, craft, and the courage to do things differently.

That's exactly why we partnered with Story Cellars and winemaker Tim Oas. Since 2016, Tim has been pioneering Washington state wines from Woodinville with a distinctive approach that mirrors our own philosophy: thoughtful, tailored, and rooted in genuine partnership.

The Velvet Vega Zin isn't just a collaboration—it's a labor of love that reflects our shared values of excellence, authenticity, and innovation. Tim's commitment to crafting exceptional wine aligns perfectly with how we approach transformation: with empathy, expertise, and a focus on outcomes that matter.

When you choose partners who share your North Star, you create something truly remarkable.

Discover the story behind our partnership: https://www.synozur.com/case-studies/story-cellars
#Partnership #CraftAndCulture #Innovation #Transformation
https://www.synozur.com/case-studies/story-cellars","https://static.wixstatic.com/media/b805ce_7aa5db4e2dbc41eeb703c838bb75db8f~mv2.png/v1/fill/w_1500,h_970,al_c/IMG_4464.PNG","","2383354","","Partnership;CraftAndCulture;Innovation;Transformation"
"Growth can expose the limits of a management model that once worked.

In our work with a thriving North American luxury manufacturer, the challenge wasn’t a lack of ambition. It was the growing friction that comes when leadership, decision-making, and operating rhythms haven’t scaled with the business.

Synozur helped the client implement a tailored Company Operating System designed to bring more structure, clarity, and accountability to how the organization operated. The result was a stronger management framework that improved leadership effectiveness, reduced internal friction, and helped the business move faster on both commercial and operational priorities.

The business impact was meaningful:
• Estimated $0.6M–$1.3M in annual cost savings
• $500K–$1.5M+ in revenue enablement
• Faster execution across key initiatives

For organizations in growth mode, transformation often starts with how leadership teams work together every day. When strategy, cadence, and accountability are aligned, better outcomes follow.

If your organization is scaling and feeling the strain, this case study offers a practical example of what a management makeover can unlock.

Read more: https://www.synozur.com/case-studies/management-makeover-at-a-luxury-brand
#LeadershipTransformation #BusinessTransformation #OperationalExcellence #ChangeManagement #GrowthStrategy
https://www.synozur.com/case-studies/management-makeover-at-a-luxury-brand","https://static.wixstatic.com/media/b805ce_3367a960d2474a518ab816eacdff0891~mv2.jpg/v1/fill/w_1067,h_760,al_c,q_85/CLO17_corporateOffice_021%20-cropped.jpg","","1761682","","LeadershipTransformation;BusinessTransformation;OperationalExcellence;ChangeManagement;GrowthStrategy"
"What happens when leadership gains a clear operating rhythm? For one luxury manufacturer: $0.6–$1.3M in annual savings and faster execution.……
#LeadershipTransformation #CompanyOS #BusinessTransformation
https://www.synozur.com/case-studies/management-makeover-at-a-luxury-brand","https://static.wixstatic.com/media/b805ce_3367a960d2474a518ab816eacdff0891~mv2.jpg/v1/fill/w_1067,h_760,al_c,q_85/CLO17_corporateOffice_021%20-cropped.jpg","","1761680","","LeadershipTransformation;CompanyOS;BusinessTransformation"
"Growth can expose cracks in even the strongest organizations. In our work with a North American luxury manufacturer, the challenge wasn’t a lack of ambition. It was the need for a stronger management framework to support scale.

Synozur helped design and introduce a tailored Company Operating System to bring more structure, alignment, and accountability to leadership. The result was a more effective operating rhythm, less internal friction, faster execution, and meaningful business impact: an estimated $0.6–$1.3M in annual cost savings and $500K–$1.5M+ in revenue enablement.

This is what transformation looks like when strategy connects clearly to day-to-day execution.

If your leadership team is growing faster than your operating model, what would change if everyone had a clearer rhythm for decisions and accountability?

Read the case study: https://www.synozur.com/case-studies/management-makeover-at-a-luxury-brand
#LeadershipTransformation #BusinessStrategy #OperationalExcellence #DigitalTransformation #ChangeManagement
https://www.synozur.com/case-studies/management-makeover-at-a-luxury-brand","https://static.wixstatic.com/media/b805ce_3367a960d2474a518ab816eacdff0891~mv2.jpg/v1/fill/w_1067,h_760,al_c,q_85/CLO17_corporateOffice_021%20-cropped.jpg","","1764931","","LeadershipTransformation;BusinessStrategy;OperationalExcellence;DigitalTransformation;ChangeManagement"
"Growth can expose every crack in a management system.

In one recent engagement, Synozur partnered with a thriving North American luxury manufacturer that had outgrown its existing operating model. The goal was clear: create a stronger Company Operating System that could support scale, improve leadership effectiveness, and reduce internal friction.

Our approach focused on bringing more structure, clarity, and accountability to how the business ran day to day. By helping leadership align around a more disciplined management framework, the organization was able to move faster on both commercial and operational priorities.

The business impact was meaningful: an estimated $0.6–$1.3M in annual cost savings, plus $500K–$1.5M+ in revenue enablement.

For leaders navigating growth, this is the real opportunity in transformation: not more noise, but a better operating rhythm that turns strategy into action.

If your organization is feeling the strain of scale, this case study is worth a look. Read more here: https://www.synozur.com/case-studies/management-makeover-at-a-luxury-brand
#CompanyOS #LeadershipTransformation #BusinessTransformation #OperationalExcellence #GrowthStrategy
https://www.synozur.com/case-studies/management-makeover-at-a-luxury-brand","https://static.wixstatic.com/media/b805ce_3367a960d2474a518ab816eacdff0891~mv2.jpg/v1/fill/w_1067,h_760,al_c,q_85/CLO17_corporateOffice_021%20-cropped.jpg","","2383354","","CompanyOS;LeadershipTransformation;BusinessTransformation;OperationalExcellence;GrowthStrategy"
"Go-to-market challenges rarely come from effort alone. More often, the issue is misalignment.

In this client engagement, a Microsoft-aligned software company partnered with Synozur to clarify its market story, sharpen its messaging, align more closely to Microsoft priorities, and strengthen partner engagement.

The result was a more focused go-to-market approach built around clearer positioning, stronger ecosystem alignment, and messaging that better connected product value to real business outcomes.

For software companies working in and around the Microsoft ecosystem, this is a common challenge:
• Your offer may be strong
• Your team may be capable
• But if your messaging, partner strategy, and market motion are not aligned, growth gets harder than it should be

That’s where tailored strategy matters. When positioning is clearer and partner engagement is stronger, teams can move with more confidence and purpose.

If you’re rethinking how your company shows up in the market, this case study offers a practical example of what aligned transformation can look like.

Read more: https://www.synozur.com/case-studies/go%E2%80%91to%E2%80%91market-transformation-for-a-microsoft%E2%80%91aligned-software-company
#GoToMarket #MicrosoftEcosystem #PartnerStrategy #B2BMarketing #BusinessTransformation
https://www.synozur.com/case-studies/go%E2%80%91to%E2%80%91market-transformation-for-a-microsoft%E2%80%91aligned-software-company","https://static.wixstatic.com/media/b805ce_03ce5f0a768b4717b69e003ba4760efa~mv2.jpeg/v1/fill/w_6240,h_4160,al_c,q_90/AdobeStock_249826261.jpeg","","1761682","","GoToMarket;MicrosoftEcosystem;PartnerStrategy;B2BMarketing;BusinessTransformation"
"When Microsoft alignment and messaging are out of sync, growth stalls. See how……
#GoToMarket #MicrosoftPartners #B2BMarketing #PartnerStrategy
https://www.synozur.com/case-studies/go%E2%80%91to%E2%80%91market-transformation-for-a-microsoft%E2%80%91aligned-software-company","https://static.wixstatic.com/media/b805ce_03ce5f0a768b4717b69e003ba4760efa~mv2.jpeg/v1/fill/w_6240,h_4160,al_c,q_90/AdobeStock_249826261.jpeg","","1761680","","GoToMarket;MicrosoftPartners;B2BMarketing;PartnerStrategy"
"When a Microsoft-aligned software company needed a clearer path to growth, they didn’t need more noise. They needed sharper positioning, stronger alignment to Microsoft, and a go-to-market approach built for real partner momentum.

That’s where Synozur came in.

We helped clarify the company’s message, strengthen its market story, and create better alignment between strategy, partner engagement, and business outcomes. The result was a more focused go-to-market foundation designed to support growth with clarity and confidence.

For organizations navigating similar challenges, this is a reminder that effective transformation starts with understanding your market, your partners, and the story you need to tell.

If your go-to-market approach feels fragmented, what would change if your messaging, partner strategy, and growth plan were fully aligned?

Read the case study: https://www.synozur.com/case-studies/go%E2%80%91to%E2%80%91market-transformation-for-a-microsoft%E2%80%91aligned-software-company
#GoToMarket #MicrosoftPartners #B2BMarketing #PartnerStrategy #BusinessTransformation
https://www.synozur.com/case-studies/go%E2%80%91to%E2%80%91market-transformation-for-a-microsoft%E2%80%91aligned-software-company","https://static.wixstatic.com/media/b805ce_03ce5f0a768b4717b69e003ba4760efa~mv2.jpeg/v1/fill/w_6240,h_4160,al_c,q_90/AdobeStock_249826261.jpeg","","1764931","","GoToMarket;MicrosoftPartners;B2BMarketing;PartnerStrategy;BusinessTransformation"
"When your product is strong but your market story is unclear, growth slows.

That was the challenge for a Microsoft-aligned software company that partnered with Synozur to sharpen its go-to-market strategy. Together, we clarified messaging, aligned the company more closely to Microsoft priorities, and strengthened partner engagement.

The result was more than better language. It created clearer market positioning, stronger internal alignment, and a more focused path to growth.

We see this often: teams know they have value, but they need a message and strategy that helps customers, partners, and sellers understand it quickly. That’s where thoughtful go-to-market transformation matters.

If your organization is trying to improve positioning, partner alignment, or market traction, this case study offers a practical example of how tailored strategy can make the desirable achievable.

Read more: https://www.synozur.com/case-studies/go%E2%80%91to%E2%80%91market-transformation-for-a-microsoft%E2%80%91aligned-software-company
#GoToMarket #MicrosoftPartner #B2BMarketing #BusinessTransformation #StrategicGrowth
https://www.synozur.com/case-studies/go%E2%80%91to%E2%80%91market-transformation-for-a-microsoft%E2%80%91aligned-software-company","https://static.wixstatic.com/media/b805ce_03ce5f0a768b4717b69e003ba4760efa~mv2.jpeg/v1/fill/w_6240,h_4160,al_c,q_90/AdobeStock_249826261.jpeg","","2383354","","GoToMarket;MicrosoftPartner;B2BMarketing;BusinessTransformation;StrategicGrowth"
"AI momentum is easy to talk about. Building real readiness is harder.

A leading education technology company partnered with Synozur to answer the questions many executive teams are facing right now:

• Where are we truly ready for AI?
• What risks do we need to address first?
• How do we align leadership around responsible adoption?
• What should the roadmap look like from here?

The result was not a generic AI conversation. It was a practical, leadership-aligned path forward grounded in business priorities, people needs, and measurable next steps.

That’s the difference between AI interest and AI readiness.

At Synozur, we believe successful transformation starts with clarity. When leaders share the same view of the opportunity, the risks, and the outcomes they want to achieve, AI becomes far more actionable.

If your organization is working to move from AI curiosity to a strategy you can trust, this case study offers a useful example of what that journey can look like.

Read more: https://www.synozur.com/case-studies/executive-ai-readiness-at-a-leading-education-technology-company
#AIReadiness #ExecutiveLeadership #ResponsibleAI #DigitalTransformation #BusinessStrategy
https://www.synozur.com/case-studies/executive-ai-readiness-at-a-leading-education-technology-company","https://static.wixstatic.com/media/b805ce_3c46f10e30d6494f9961c3c265212750~mv2.jpeg/v1/fill/w_5472,h_3204,al_c,q_90/AdobeStock_670678012.jpeg","","1761682","","AIReadiness;ExecutiveLeadership;ResponsibleAI;DigitalTransformation;BusinessStrategy"
"Responsible AI starts with leadership alignment and a practical roadmap. See how Synozur helped an education……
#AIReadiness #ResponsibleAI #LeadershipAlignment #EdTech
https://www.synozur.com/case-studies/executive-ai-readiness-at-a-leading-education-technology-company","https://static.wixstatic.com/media/b805ce_3c46f10e30d6494f9961c3c265212750~mv2.jpeg/v1/fill/w_5472,h_3204,al_c,q_90/AdobeStock_670678012.jpeg","","1761680","","AIReadiness;ResponsibleAI;LeadershipAlignment;EdTech"
"AI momentum means very little without leadership alignment, clear priorities, and a practical path forward.

In our work with a leading education technology company, Synozur helped assess executive AI readiness, align stakeholders around responsible adoption, and shape a roadmap grounded in real business needs. The goal was not to chase hype. It was to give leaders the clarity and confidence to move forward in a thoughtful, measurable way.

That’s what effective AI strategy looks like: understanding where you are, identifying what matters most, and building a tailored plan your people can actually use.

If your leadership team is asking where to begin with AI, this case study offers a helpful example of what readiness can look like in practice. Read more: https://www.synozur.com/case-studies/executive-ai-readiness-at-a-leading-education-technology-company

What does AI readiness mean for your organization right now?
#AIStrategy #AIReadiness #DigitalTransformation #LeadershipAlignment #ResponsibleAI
https://www.synozur.com/case-studies/executive-ai-readiness-at-a-leading-education-technology-company","https://static.wixstatic.com/media/b805ce_3c46f10e30d6494f9961c3c265212750~mv2.jpeg/v1/fill/w_5472,h_3204,al_c,q_90/AdobeStock_670678012.jpeg","","1764931","","AIStrategy;AIReadiness;DigitalTransformation;LeadershipAlignment;ResponsibleAI"
"AI readiness starts long before implementation.

A leading education technology company partnered with Synozur to answer a question many leadership teams are facing right now: Are we truly ready to adopt AI in a way that is practical, responsible, and aligned across the business?

Together, we helped assess organizational readiness, align executives around shared priorities, and define a clear roadmap for responsible AI adoption. The result was not a generic technology conversation. It was a focused strategy grounded in business value, governance, and the people who would ultimately bring that strategy to life.

That’s the difference between chasing AI hype and building real momentum. When leadership alignment, clear priorities, and responsible design come first, organizations are better positioned to move with confidence.

If your team is working through similar questions, this story offers a practical look at what executive AI readiness can look like in action.

Read more: https://www.synozur.com/case-studies/executive-ai-readiness-at-a-leading-education-technology-company
#AIReadiness #ExecutiveLeadership #DigitalTransformation #ResponsibleAI #BusinessStrategy
https://www.synozur.com/case-studies/executive-ai-readiness-at-a-leading-education-technology-company","https://static.wixstatic.com/media/b805ce_3c46f10e30d6494f9961c3c265212750~mv2.jpeg/v1/fill/w_5472,h_3204,al_c,q_90/AdobeStock_670678012.jpeg","","2383354","","AIReadiness;ExecutiveLeadership;DigitalTransformation;ResponsibleAI;BusinessStrategy"
"AI should make work easier, not create more noise, risk, or distrust.

That was the challenge a fast-growing strategic communications firm set out to solve when it partnered with Synozur. As the business scaled, teams were spending too much time searching for information, recreating work, and navigating disconnected tools. Leadership wanted to explore AI—but in a way that protected client trust and fit how people actually work.

The result was a people-first AI and knowledge transformation approach grounded in real workflows, clear governance, and practical use cases. By pairing AI strategy with Microsoft 365 enablement, the firm built a stronger foundation for research, drafting, collaboration, and knowledge discovery.

What changed?
• A clear AI strategy aligned to business needs
• Better knowledge sharing with less duplicate work
• More team confidence using AI responsibly
• A scalable path for continued innovation

For professional services firms, this is the real opportunity: use AI to support human expertise, not replace it.

If your organization is trying to move past the hype and build an AI strategy people will actually trust and use, this story is worth a read: https://www.synozur.com/case-studies/ai-and-knowledge-transformation-at-a-strategic-communications-firm
#AIStrategy #KnowledgeManagement #ProfessionalServices #Microsoft365 #DigitalTransformation
https://www.synozur.com/case-studies/ai-and-knowledge-transformation-at-a-strategic-communications-firm","https://static.wixstatic.com/media/b805ce_ac5ee1b33b6a4b34b7f0e6d0055de8fd~mv2.jpeg/v1/fill/w_6720,h_4480,al_c,q_90/AdobeStock_216576334.jpeg","","1761682","","AIStrategy;KnowledgeManagement;ProfessionalServices;Microsoft365;DigitalTransformation"
"AI works best when it reduces friction, strengthens trust, and fits how people already work. See……
#AITransformation #KnowledgeManagement #ProfessionalServices #Microsoft365
https://www.synozur.com/case-studies/ai-and-knowledge-transformation-at-a-strategic-communications-firm","https://static.wixstatic.com/media/b805ce_ac5ee1b33b6a4b34b7f0e6d0055de8fd~mv2.jpeg/v1/fill/w_6720,h_4480,al_c,q_90/AdobeStock_216576334.jpeg","","1761680","","AITransformation;KnowledgeManagement;ProfessionalServices;Microsoft365"
"AI should reduce friction, not add more noise.

In this case study, a fast-growing strategic communications firm partnered with Synozur to build an AI strategy that fit the way their people actually work. The focus wasn’t AI for its own sake. It was practical, people-first transformation: stronger governance, better knowledge sharing, less duplicate work, and more confidence using AI in a high-trust client environment.

By grounding the strategy in real workflows and pairing it with Microsoft 365 enablement, the firm created a scalable foundation for innovation without compromising culture or client trust.

That’s the kind of transformation that lasts: clear strategy, responsible adoption, and outcomes teams can feel in their day-to-day work.

What would make AI feel more like a support system in your organization?

Read the case study: https://www.synozur.com/case-studies/ai-and-knowledge-transformation-at-a-strategic-communications-firm
#AITransformation #KnowledgeManagement #Microsoft365 #FutureOfWork #ChangeManagement
https://www.synozur.com/case-studies/ai-and-knowledge-transformation-at-a-strategic-communications-firm","https://static.wixstatic.com/media/b805ce_ac5ee1b33b6a4b34b7f0e6d0055de8fd~mv2.jpeg/v1/fill/w_6720,h_4480,al_c,q_90/AdobeStock_216576334.jpeg","","1764931","","AITransformation;KnowledgeManagement;Microsoft365;FutureOfWork;ChangeManagement"
"AI should make work easier—not add noise, risk, or confusion.

That was the challenge facing a fast-growing strategic communications firm as it scaled. Teams were spending too much time searching for information, recreating work, and managing disconnected tools. Leadership wanted to explore AI, but in a way that protected client trust and fit how people actually work.

Our approach started with listening. From there, we helped shape a business-aligned AI strategy, establish governance, identify practical use cases for research and drafting, modernize knowledge management with Microsoft 365, and build confidence through targeted training.

The outcome wasn’t “AI for AI’s sake.” It was a people-first foundation for better knowledge flow, less duplicate work, and more confident adoption.

That’s the difference between introducing technology and creating meaningful transformation: strategy, clarity, and a real fit for your culture.

Read the full case study here: https://www.synozur.com/case-studies/ai-and-knowledge-transformation-at-a-strategic-communications-firm
#AIStrategy #KnowledgeManagement #DigitalTransformation #Microsoft365 #FutureOfWork
https://www.synozur.com/case-studies/ai-and-knowledge-transformation-at-a-strategic-communications-firm","https://static.wixstatic.com/media/b805ce_ac5ee1b33b6a4b34b7f0e6d0055de8fd~mv2.jpeg/v1/fill/w_6720,h_4480,al_c,q_90/AdobeStock_216576334.jpeg","","2383354","","AIStrategy;KnowledgeManagement;DigitalTransformation;Microsoft365;FutureOfWork"