Post Content,Image URL,Date/Time,Account ID,First Comment,Tags
"When employee experience improves, business results follow: one energy company unlocked an estimated $2M–$6M……
#EmployeeExperience #DigitalWorkplace #Productivity #Transformation
https://www.synozur.com/case-studies/energy-company-reinvents-employee-expereince-and-effectiveness","https://static.wixstatic.com/media/b805ce_d48bad9f6faa40e58e764f1ead186a5a~mv2.jpg/v1/fill/w_2000,h_1333,al_c,q_90/Ofc17_Truck_Sonia_001.jpg","","1761680","","EmployeeExperience;DigitalWorkplace;Productivity;Transformation"
"Moving from scattered AI experiments to governed, measurable outcomes can unlock real value: this PE portfolio company saw estimated……
#AITransformation #PrivateEquity #BusinessOutcomes
https://www.synozur.com/case-studies/ai-transformation-at-a-private-equity-portfolio-company","https://static.wixstatic.com/media/b805ce_216de3dbbef94823a2eecb2d3a72bf2b~mv2.jpg/v1/fill/w_2172,h_1313,al_c,q_90/AdobeStock_151524961Small.jpg","","1761680","","AITransformation;PrivateEquity;BusinessOutcomes"
"Employee experience is not a soft metric. It has real operational and financial impact.

In one recent engagement, a North American energy company with 12,000+ employees faced a familiar challenge: outdated internal tools, low engagement, and too much time lost searching for information.

Synozur helped reimagine the experience by mapping the employee journey, identifying friction points, and designing more relevant tools, content, and communication pathways around how people actually work.

The result: an estimated $2.0M–$6.0M in annual productivity gains driven by reduced search time, more streamlined internal communications, and stronger employee engagement.

When organizations make it easier for people to find what they need, understand what matters, and stay connected, effectiveness improves across the business.

If you’re looking at employee experience, intranet modernization, or internal communications strategy, this case study shows what thoughtful, people-centered transformation can deliver.

Read more: https://www.synozur.com/case-studies/energy-company-reinvents-employee-expereince-and-effectiveness
#EmployeeExperience #InternalCommunications #DigitalTransformation #Productivity #ChangeManagement
https://www.synozur.com/case-studies/energy-company-reinvents-employee-expereince-and-effectiveness","https://static.wixstatic.com/media/b805ce_d48bad9f6faa40e58e764f1ead186a5a~mv2.jpg/v1/fill/w_2000,h_1333,al_c,q_90/Ofc17_Truck_Sonia_001.jpg","","1761682","","EmployeeExperience;InternalCommunications;DigitalTransformation;Productivity;ChangeManagement"
"When employee experience breaks down, productivity and engagement usually follow.

A North American energy company came to Synozur with a challenge many large organizations know well: outdated intranet tools, hard-to-find information, and communications that weren’t reaching people in meaningful ways. With 12,000+ employees, even small friction points added up fast.

By mapping the employee journey and redesigning the experience around what people actually needed, the organization improved access to relevant tools and information—and unlocked an estimated $2.0M–$6.0M in annual productivity gains.

It’s a strong reminder that better employee experience is not just a culture initiative. It’s a business outcome.

Where are your teams losing time today because the digital experience isn’t working for them? Read the case study: https://www.synozur.com/case-studies/energy-company-reinvents-employee-expereince-and-effectiveness
#EmployeeExperience #DigitalTransformation #WorkplaceStrategy #InternalCommunications #BusinessOutcomes
https://www.synozur.com/case-studies/energy-company-reinvents-employee-expereince-and-effectiveness","https://static.wixstatic.com/media/b805ce_d48bad9f6faa40e58e764f1ead186a5a~mv2.jpg/v1/fill/w_2000,h_1333,al_c,q_90/Ofc17_Truck_Sonia_001.jpg","","1764931","","EmployeeExperience;DigitalTransformation;WorkplaceStrategy;InternalCommunications;BusinessOutcomes"
"What happens when 12,000+ employees can finally find the information, tools, and support they need to do their jobs well?

For one North American energy company, the answer was a meaningful reinvention of employee experience.

Facing low engagement, outdated internal tools, and friction in day-to-day communication, they partnered with Synozur to take a more human-centered approach. We mapped the employee journey, identified where the experience was breaking down, and helped redesign access to relevant tools and information around real employee needs.

The outcome was more than a better intranet. It was a more effective digital workplace built to reduce search time, streamline internal communications, and improve engagement at scale.

Estimated impact: $2.0M–$6.0M in annual productivity gains.

When employee experience improves, business results follow.

Read the full case study here: https://www.synozur.com/case-studies/energy-company-reinvents-employee-expereince-and-effectiveness
#EmployeeExperience #DigitalWorkplace #BusinessTransformation #InternalCommunications #FutureOfWork
https://www.synozur.com/case-studies/energy-company-reinvents-employee-expereince-and-effectiveness","https://static.wixstatic.com/media/b805ce_d48bad9f6faa40e58e764f1ead186a5a~mv2.jpg/v1/fill/w_2000,h_1333,al_c,q_90/Ofc17_Truck_Sonia_001.jpg","","2383354","","EmployeeExperience;DigitalWorkplace;BusinessTransformation;InternalCommunications;FutureOfWork"
"AI transformation creates value when it moves beyond isolated experiments and into governed, business-aligned execution.

In one recent private equity portfolio company engagement, Synozur helped a financial services organization turn scattered AI activity into a focused roadmap built around real documents, real workflows, and measurable outcomes.

The work centered on three priorities:
• identifying and prioritizing the right AI use cases
• establishing a practical governance model
• upskilling leaders and makers through a multi-tool curriculum

The result: an estimated $250K–$500K in annual cost savings and $500K–$1.0M+ in EBITDA uplift.

What made the difference wasn’t hype. It was clarity, discipline, and a people-centered approach to adoption.

For private equity leaders and portfolio operators, this is the real opportunity with AI: faster decision-making, less duplicated analysis, and better execution across leadership and operations.

If your organization is trying to turn AI interest into tangible business results, this case study offers a practical example of what that can look like. Read more here: https://www.synozur.com/case-studies/ai-transformation-at-a-private-equity-portfolio-company
#AITransformation #PrivateEquity #BusinessTransformation #DigitalStrategy #OperationalExcellence
https://www.synozur.com/case-studies/ai-transformation-at-a-private-equity-portfolio-company","https://static.wixstatic.com/media/b805ce_216de3dbbef94823a2eecb2d3a72bf2b~mv2.jpg/v1/fill/w_2172,h_1313,al_c,q_90/AdobeStock_151524961Small.jpg","","1761682","","AITransformation;PrivateEquity;BusinessTransformation;DigitalStrategy;OperationalExcellence"
"AI value doesn’t come from scattered experiments. It comes from clear priorities, practical governance, and a team that knows how to turn ideas into outcomes.

In this private equity portfolio company case study, Synozur helped a financial-services organization move from disconnected AI activity to an enterprise approach grounded in real workflows, measurable use cases, and leadership alignment. The result: an estimated $250K–$500K in annual cost savings and $500K–$1.0M+ in EBITDA uplift.

What stands out to us is simple: when AI strategy is tied to business discipline, better decisions follow. Teams reduce duplicated analysis, improve execution, and create momentum that lasts.

If your organization is exploring AI, are you still experimenting—or are you building for measurable impact?

Read the full case study: https://www.synozur.com/case-studies/ai-transformation-at-a-private-equity-portfolio-company
#AITransformation #PrivateEquity #BusinessStrategy #DigitalTransformation #OperationalExcellence
https://www.synozur.com/case-studies/ai-transformation-at-a-private-equity-portfolio-company","https://static.wixstatic.com/media/b805ce_216de3dbbef94823a2eecb2d3a72bf2b~mv2.jpg/v1/fill/w_2172,h_1313,al_c,q_90/AdobeStock_151524961Small.jpg","","1764931","","AITransformation;PrivateEquity;BusinessStrategy;DigitalTransformation;OperationalExcellence"
"AI value doesn’t come from scattered experiments. It comes from focus, governance, and execution.

In one private equity portfolio company, Synozur helped leadership move from disconnected AI activity to a practical, enterprise-ready approach built around real business outcomes. We worked from actual documents and workflows, prioritized the most valuable use cases, established a governance model, and upskilled both leaders and makers through a multi-tool curriculum.

The result was measurable impact: an estimated $250K–$500K in annual cost savings and $500K–$1.0M+ in EBITDA uplift.

What changed?

Smarter decision-making.
Less duplicated analysis.
Stronger execution discipline across leadership and operations.

This is what AI transformation should look like: tailored to the business, grounded in real work, and designed to create results people can actually sustain.

If your organization is trying to turn AI momentum into measurable value, this case study offers a practical example of what that journey can look like.

Read more: https://www.synozur.com/case-studies/ai-transformation-at-a-private-equity-portfolio-company
#AITransformation #PrivateEquity #BusinessStrategy #DigitalTransformation #Leadership
https://www.synozur.com/case-studies/ai-transformation-at-a-private-equity-portfolio-company","https://static.wixstatic.com/media/b805ce_216de3dbbef94823a2eecb2d3a72bf2b~mv2.jpg/v1/fill/w_2172,h_1313,al_c,q_90/AdobeStock_151524961Small.jpg","","2383354","","AITransformation;PrivateEquity;BusinessStrategy;DigitalTransformation;Leadership"
"AI momentum means very little without the governance to support it.

In one recent private equity engagement, Synozur helped a firm accelerate AI readiness while also strengthening the foundations that make adoption sustainable: governance, security, and executive alignment.

That balance matters.

For private equity leaders, the opportunity is not just to move quickly. It is to move with clarity across the portfolio, reduce risk, and make sure AI investments connect to real business outcomes.

Our approach focused on turning urgency into a practical roadmap—aligning leadership, identifying where AI could create value, and putting the right guardrails in place from the start.

The result: faster progress, stronger confidence, and a path that was tailored to the firm’s unique needs.

If your organization is trying to advance AI without creating new governance gaps, this case study offers a useful example of what that can look like in practice.

Read more: https://www.synozur.com/case-studies/ai-%26-governance-acceleration-for-private-equity
#AIReadiness #AIGovernance #PrivateEquity #DigitalTransformation #ExecutiveAlignment
https://www.synozur.com/case-studies/ai-%26-governance-acceleration-for-private-equity","https://static.wixstatic.com/media/b805ce_a67e17e43687429ebb2e6bffe60af815~mv2.jpeg/v1/fill/w_6627,h_4418,al_c,q_90/AdobeStock_502007078.jpeg","","1761682","","AIReadiness;AIGovernance;PrivateEquity;DigitalTransformation;ExecutiveAlignment"
"AI adoption moves faster when governance, security, and executive alignment move with it. See how Synozur helped a PE firm……
#AIReadiness #PrivateEquity #AIGovernance #ExecutiveAlignment
https://www.synozur.com/case-studies/ai-%26-governance-acceleration-for-private-equity","https://static.wixstatic.com/media/b805ce_a67e17e43687429ebb2e6bffe60af815~mv2.jpeg/v1/fill/w_6627,h_4418,al_c,q_90/AdobeStock_502007078.jpeg","","1761680","","AIReadiness;PrivateEquity;AIGovernance;ExecutiveAlignment"
"AI momentum means very little without the governance to support it.

In this client story, a private equity firm partnered with Synozur to accelerate AI readiness while also strengthening security, governance, and executive alignment. That balance matters. When leadership teams move quickly with clarity, they can explore AI opportunities with more confidence and reduce the risk of fragmented decisions.

What stands out to us is that successful AI transformation is never just about technology. It’s about aligning people, priorities, and practical next steps so progress is measurable and sustainable.

If your organization is trying to move faster on AI without losing sight of governance and business outcomes, this is a useful example of what that can look like in practice.

Read the case study here: https://www.synozur.com/case-studies/ai-%26-governance-acceleration-for-private-equity
#AIReadiness #AIGovernance #PrivateEquity #DigitalTransformation #ExecutiveAlignment
https://www.synozur.com/case-studies/ai-%26-governance-acceleration-for-private-equity","https://static.wixstatic.com/media/b805ce_a67e17e43687429ebb2e6bffe60af815~mv2.jpeg/v1/fill/w_6627,h_4418,al_c,q_90/AdobeStock_502007078.jpeg","","1764931","","AIReadiness;AIGovernance;PrivateEquity;DigitalTransformation;ExecutiveAlignment"
"AI momentum means little without governance, security, and executive alignment.

That was the challenge facing a private equity firm that needed to move quickly while still building the right foundation. Synozur partnered with their team to accelerate AI readiness in a way that was practical, responsible, and tied to real business outcomes.

The work focused on more than just AI ambition. It brought leadership together around clear priorities, strengthened governance, addressed security considerations, and created a path forward that balanced speed with confidence.

For private equity leaders, this is the real opportunity: not just adopting AI, but doing it in a way that supports portfolio value, reduces risk, and helps teams move with clarity.

At Synozur, we believe transformation works best when it is tailored to your context, grounded in empathy, and designed for measurable progress.

Read the case study here: https://www.synozur.com/case-studies/ai-%26-governance-acceleration-for-private-equity
#PrivateEquity #AIStrategy #AIGovernance #DigitalTransformation #ExecutiveAlignment
https://www.synozur.com/case-studies/ai-%26-governance-acceleration-for-private-equity","https://static.wixstatic.com/media/b805ce_a67e17e43687429ebb2e6bffe60af815~mv2.jpeg/v1/fill/w_6627,h_4418,al_c,q_90/AdobeStock_502007078.jpeg","","2383354","","PrivateEquity;AIStrategy;AIGovernance;DigitalTransformation;ExecutiveAlignment"
"Bringing an AI product to market takes more than a strong idea.

It takes clear positioning, focused product leadership, aligned sales motion, and the right go-to-market strategy to turn momentum into measurable results.

In one recent client engagement, Synozur partnered with a leading AI ISV that had built an app for generative AI systems like Microsoft Copilot to connect disconnected content. We provided fractional product and marketing leadership to sharpen messaging, refine app design, shape the go-to-market plan, recruit sales leadership, and mentor the internal team through launch.

The outcome: an estimated $0.8M–$1.2M in incremental revenue over 12–24 months, plus $250K–$500K in cost avoidance.

For growing software companies, this is the value of tailored, outcome-focused advisory support: faster execution, clearer market stories, and stronger early-stage conversion.

If you’re preparing to launch, reposition, or accelerate an AI offering, this case study shows what focused go-to-market leadership can unlock.

Read more: https://www.synozur.com/case-studies/accelerating-go-to-market-for-a-leading-ai-isv
#GoToMarket #AITransformation #ProductMarketing #B2BMarketing #MicrosoftEcosystem
https://www.synozur.com/case-studies/accelerating-go-to-market-for-a-leading-ai-isv","https://static.wixstatic.com/media/b805ce_03dd23de63224d67a613ec1398ab3143~mv2.jpeg/v1/fill/w_6720,h_4480,al_c,q_90/AdobeStock_456986840.jpeg","","1761682","","GoToMarket;AITransformation;ProductMarketing;B2BMarketing;MicrosoftEcosystem"
"Clear positioning and faster GTM execution helped an AI ISV unlock an estimated $0.8M-$1.2M in revenue. See how:…
#GoToMarket #AIStrategy #ProductMarketing
https://www.synozur.com/case-studies/accelerating-go-to-market-for-a-leading-ai-isv","https://static.wixstatic.com/media/b805ce_03dd23de63224d67a613ec1398ab3143~mv2.jpeg/v1/fill/w_6720,h_4480,al_c,q_90/AdobeStock_456986840.jpeg","","1761680","","GoToMarket;AIStrategy;ProductMarketing"
"When a leading AI ISV needed to bring a new generative AI app to market, they didn’t need more noise. They needed clear positioning, practical leadership, and a go-to-market strategy that could move quickly.

Synozur stepped in with fractional product and marketing leadership to help shape new messaging, refine app design, strengthen launch plans, recruit sales leadership, and mentor the internal team. The outcome: faster execution, stronger early-stage conversion, and an estimated $0.8M–$1.2M in incremental revenue over 12–24 months, along with $250K–$500K in cost avoidance.

It’s a strong example of what happens when strategy, product, and go-to-market work together around real business outcomes.

If your team is building an AI offering and needs a clearer path from product vision to market traction, this story is worth a read: https://www.synozur.com/case-studies/accelerating-go-to-market-for-a-leading-ai-isv

What’s the biggest go-to-market challenge your team is facing right now?
#GoToMarket #AIStrategy #ProductLeadership #B2BMarketing #DigitalTransformation
https://www.synozur.com/case-studies/accelerating-go-to-market-for-a-leading-ai-isv","https://static.wixstatic.com/media/b805ce_03dd23de63224d67a613ec1398ab3143~mv2.jpeg/v1/fill/w_6720,h_4480,al_c,q_90/AdobeStock_456986840.jpeg","","1764931","","GoToMarket;AIStrategy;ProductLeadership;B2BMarketing;DigitalTransformation"
"When a strong product is ready for market, clarity and speed matter.

We partnered with a leading AI ISV that had built an app connecting disconnected content into generative AI experiences like Microsoft Copilot. The opportunity was clear, but turning that innovation into market momentum required the right story, design, and go-to-market focus.

Synozur stepped in with fractional product and marketing leadership to help shape sharper messaging, new app designs, and a strategic launch plan. We also supported sales leadership recruiting and team mentoring to help the organization move with confidence.

The outcome: an estimated $0.8M–$1.2M in incremental revenue over 12–24 months, plus $250K–$500K in cost avoidance through faster execution, clearer positioning, and stronger early-stage conversion.

For growing AI companies, go-to-market success is rarely about doing more. It’s about aligning product, message, and leadership around the outcomes that matter most.

Read the case study here: https://www.synozur.com/case-studies/accelerating-go-to-market-for-a-leading-ai-isv
#GoToMarket #AITransformation #ProductMarketing #B2BGrowth #MicrosoftCopilot
https://www.synozur.com/case-studies/accelerating-go-to-market-for-a-leading-ai-isv","https://static.wixstatic.com/media/b805ce_03dd23de63224d67a613ec1398ab3143~mv2.jpeg/v1/fill/w_6720,h_4480,al_c,q_90/AdobeStock_456986840.jpeg","","2383354","","GoToMarket;AITransformation;ProductMarketing;B2BGrowth;MicrosoftCopilot"
"What happens when annual planning stops being a one-time offsite and becomes a stronger management framework?

In one Microsoft engagement, Synozur helped a marketing team rethink how goals were set, how teams aligned, and how planning translated into action. The result was more than a better meeting structure.

It led to a more dynamic operating rhythm, improved cross-team alignment, faster marketing execution, and an estimated $0.5M–$1.0M in annual productivity cost avoidance. It also influenced additional multi-million-dollar revenue opportunities.

For leaders, this is the real value of management transformation: clearer priorities, better decision-making, and a cadence that helps teams move with focus.

There is no one-size-fits-all model for this work. The right framework has to fit your people, your culture, and the outcomes you need to achieve.

If your planning process feels heavy, disconnected, or hard to turn into results, this case study offers a practical example of what a tailored approach can unlock.

Read more here: https://www.synozur.com/case-studies/transforming-management-frameworks-at-microsoft
#ManagementTransformation #StrategicPlanning #BusinessTransformation #OperationalExcellence #LeadershipStrategy
https://www.synozur.com/case-studies/transforming-management-frameworks-at-microsoft","https://static.wixstatic.com/media/b805ce_759217ee0d84438089805ae72a743c3a~mv2.jpg/v1/fill/w_2000,h_1333,al_c,q_90/Win16a_BCN_Students2_Table_HPSpectrex360_01416.jpg","","1761682","","ManagementTransformation;StrategicPlanning;BusinessTransformation;OperationalExcellence;LeadershipStrategy"
"A stronger planning cadence can do more than streamline meetings—it can unlock major business value. See how Synozur……
#BusinessTransformation #LeadershipStrategy #Productivity #OperatingModel
https://www.synozur.com/case-studies/transforming-management-frameworks-at-microsoft","https://static.wixstatic.com/media/b805ce_759217ee0d84438089805ae72a743c3a~mv2.jpg/v1/fill/w_2000,h_1333,al_c,q_90/Win16a_BCN_Students2_Table_HPSpectrex360_01416.jpg","","1761680","","BusinessTransformation;LeadershipStrategy;Productivity;OperatingModel"
"What happens when an annual planning offsite becomes a true operating rhythm for the business?

In our work with one of Microsoft’s marketing teams, the goal was clear: move beyond static planning and build a more dynamic, effective management framework. By rethinking planning cadence, improving cross-team alignment, and creating a stronger path from strategy to execution, the team unlocked meaningful business value.

The impact: an estimated $0.5M–$1.0M in annual productivity cost avoidance, plus additional multi-million-dollar revenue influence driven by faster marketing execution and better coordination.

For leaders facing the same challenge, this is a useful reminder that better management systems are not just operational improvements. They create space for focus, speed, and innovation.

Could your planning process be doing more to support outcomes across your teams?

Read the case study: https://www.synozur.com/case-studies/transforming-management-frameworks-at-microsoft
#ManagementTransformation #StrategicAlignment #BusinessTransformation #OperationalExcellence
https://www.synozur.com/case-studies/transforming-management-frameworks-at-microsoft","https://static.wixstatic.com/media/b805ce_759217ee0d84438089805ae72a743c3a~mv2.jpg/v1/fill/w_2000,h_1333,al_c,q_90/Win16a_BCN_Students2_Table_HPSpectrex360_01416.jpg","","1764931","","ManagementTransformation;StrategicAlignment;BusinessTransformation;OperationalExcellence"
"What happens when annual planning stops being a meeting and starts becoming a management system?

For one Microsoft marketing team, that shift changed everything.

Synozur partnered with the team to redesign their annual planning offsite into a stronger management framework built for clearer goals, better alignment, and faster execution. The result was more than a better workshop. It created a more dynamic planning cadence, improved cross-team coordination, and helped the organization move from conversation to action.

The business impact was meaningful: an estimated $0.5M–$1.0M in annual productivity cost avoidance, along with additional multi-million-dollar revenue influence driven by better planning and faster marketing execution.

We believe transformation works best when it is practical, people-centered, and tied to real outcomes. This case study is a strong example of how the right management framework can improve productivity and create lasting momentum.

Read the full story here: https://www.synozur.com/case-studies/transforming-management-frameworks-at-microsoft
#BusinessTransformation #LeadershipStrategy #OperationalExcellence #ManagementFrameworks #FutureOfWork
https://www.synozur.com/case-studies/transforming-management-frameworks-at-microsoft","https://static.wixstatic.com/media/b805ce_759217ee0d84438089805ae72a743c3a~mv2.jpg/v1/fill/w_2000,h_1333,al_c,q_90/Win16a_BCN_Students2_Table_HPSpectrex360_01416.jpg","","2383354","","BusinessTransformation;LeadershipStrategy;OperationalExcellence;ManagementFrameworks;FutureOfWork"
